{
  "reasoning_result": {
    "metadata": {
      "resultId": "RSN-20260529-001",
      "generatedAt": "2026-05-29T00:00:00+08:00",
      "userQuestion": "核心产品扩产是不是利好关键设备供应商？研究员推荐关键设备公司，我该问什么？",
      "taskMode": "pm_question_list",
      "status": "candidate"
    },
    "ontology_context": {
      "ontologyInputs": [
        {
          "ontologyId": "ONT-EXAMPLE-INDUSTRY-001",
          "ontologyName": "示例行业关键设备本体",
          "ontologyVersion": "example",
          "ontologySourceType": "curated_ontology",
          "sourceSkill": "external_or_manual",
          "conformsTo": "投研本体核心规范",
          "sourceDocumentIds": ["SRC-20260529-001"],
          "objectCount": 22,
          "relationCount": 34,
          "coverageNotes": "本体已覆盖示例行业、核心产品、关键设备、资本开支、订单能见度、供应商份额和资产影响候选链路。",
          "limitations": [
            "示例不代表真实行业、公司或订单。",
            "核心产品扩产到不同设备品类的分路线弹性仍需补充材料和本体维护。"
          ]
        },
        {
          "ontologyId": "ONT-EXAMPLE-COMPANY-001",
          "ontologyName": "示例关键设备公司本体",
          "ontologyVersion": "example",
          "ontologySourceType": "manual_ontology",
          "sourceSkill": "manual_input",
          "conformsTo": "投研本体核心规范",
          "sourceDocumentIds": ["SRC-20260529-002"],
          "objectCount": 9,
          "relationCount": 12,
          "coverageNotes": "公司本体提供设备品类、客户导入、订单能见度和资产映射的局部信息。",
          "limitations": [
            "公司本体未覆盖完整行业竞争格局。",
            "客户份额和收入确认节奏仍缺少观测值。"
          ]
        }
      ],
      "governingSchema": "投研本体核心规范",
      "mergeStrategy": "以行业本体定义传导关系，以公司本体补充公司、产品、客户和资产敞口；冲突时标记为待核验，不覆盖原本体。",
      "scopeAlignment": "两个本体共同覆盖核心产品扩产、关键设备订单和公司经营兑现问题。",
      "conflictResolution": [
        "若公司本体与行业本体的设备品类口径不同，先输出口径差异，不做合并假设。",
        "若关系在任一本体中缺失，写入 ontology_feedback。"
      ],
      "limitations": [
        "本示例只展示多本体推理上下文，不代表真实行业或公司。",
        "缺少真实订单、份额和市场预期数据。"
      ]
    },
    "query_understanding": {
      "rawInputType": "general_question",
      "detectedIntent": "pm_question_list",
      "modeRoutingReason": "用户同时询问观点是否成立和应该质询研究员什么，输出应以投资经理质询清单为主，而不是完整研报。",
      "targetRole": "portfolio_manager",
      "keyQuestion": "核心产品扩产是否能沿本体链路传导到关键设备订单和资产影响候选；若研究员推荐相关设备公司，应追问哪些假设、数据和反证条件。",
      "scope": ["示例行业", "核心产品", "关键设备", "资本开支", "订单能见度"],
      "timeSensitivity": "需要结合最新扩产、资本开支、订单和交付节奏持续验证。",
      "queryConfidence": "medium"
    },
    "evidence_pack": {
      "adopted_sources": [
        {
          "sourceId": "SRC-20260529-001",
          "title": "示例本体来源文档集合",
          "publisher": "ontology_pipeline",
          "publishTime": "2026-05-29",
          "sourceLocation": "ontology_context:source_documents",
          "sourceReliability": "medium",
          "sourceRole": "ontology_source",
          "keyFacts": [
            "本体中已有核心产品扩产、关键设备资本开支、设备订单能见度和供应商份额相关变量。",
            "本体中已有核心产品扩产变量向关键设备资本开支变量传导的候选关系。"
          ]
        },
        {
          "sourceId": "SRC-20260529-002",
          "title": "用户输入：扩产与关键设备质询问题",
          "publisher": "manual_input",
          "publishTime": "2026-05-29",
          "sourceLocation": "conversation:user_question",
          "sourceReliability": "medium",
          "sourceRole": "user_material",
          "keyFacts": [
            "用户关注核心产品扩产是否利好关键设备供应商。",
            "用户需要面向投资经理场景的研究员质询清单。"
          ]
        }
      ],
      "rejected_sources": [
        {
          "title_or_url": "未标明出处的设备订单传闻",
          "reason": "无法确认客户、订单金额、交付周期和供应商份额，不作为链路事实。"
        }
      ],
      "evidence_quality_summary": "当前示例主要依赖本体上下文和用户问题；可形成候选推理链和质询方向，但不能直接确认真实订单、收入或资产定价影响。",
      "source_limitations": [
        "缺少真实扩产投资额和设备采购结构。",
        "缺少设备供应商订单、份额、交付周期和收入确认数据。",
        "缺少市场预期是否已反映的定价证据。"
      ]
    },
    "ontology_retrieval": {
      "retrieval_strategy": "以核心产品扩产和关键设备为入口，检索产业链环节、产品、状态变量、变量传导、假设、判断输出和资产影响候选。",
      "matched_objects": [
        {
          "objectId": "IND-EXAMPLE-001",
          "objectType": "Industry",
          "name": "示例行业",
          "matchReason": "用户问题所属行业本体。",
          "relevance": "high"
        },
        {
          "objectId": "SEG-CORE-PRODUCT-001",
          "objectType": "Segment",
          "name": "核心产品环节",
          "matchReason": "扩产触发点所在环节。",
          "relevance": "high"
        },
        {
          "objectId": "SEG-KEY-EQUIPMENT-001",
          "objectType": "Segment",
          "name": "关键设备环节",
          "matchReason": "用户关心的受益环节。",
          "relevance": "high"
        },
        {
          "objectId": "PRD-EQUIPMENT-A-001",
          "objectType": "Product",
          "name": "关键设备 A",
          "matchReason": "扩产可能带来的设备采购品类。",
          "relevance": "medium"
        },
        {
          "objectId": "SV-CORE-CAPEX-001",
          "objectType": "StateVariable",
          "name": "核心产品扩产强度",
          "matchReason": "用户问题中的核心触发变量。",
          "relevance": "high"
        },
        {
          "objectId": "SV-EQUIP-CAPEX-001",
          "objectType": "StateVariable",
          "name": "关键设备资本开支强度",
          "matchReason": "扩产向设备供应商传导的中间变量。",
          "relevance": "high"
        },
        {
          "objectId": "SV-EQUIP-ORDER-001",
          "objectType": "StateVariable",
          "name": "关键设备订单能见度",
          "matchReason": "设备供应商经营兑现需要验证的变量。",
          "relevance": "high"
        },
        {
          "objectId": "SH-CORE-EQUIP-001",
          "objectType": "StateHypothesis",
          "name": "核心产品扩产拉动关键设备需求",
          "matchReason": "用户观点对应的候选状态假设。",
          "relevance": "high"
        },
        {
          "objectId": "JO-EQUIP-DEMAND-001",
          "objectType": "JudgmentOutput",
          "name": "关键设备景气度提升候选",
          "matchReason": "研究员推荐可能依赖的判断输出。",
          "relevance": "medium"
        }
      ],
      "matched_relations": [
        {
          "relationId": "REL-SEG-IND-001",
          "relationType": "segmentBelongsToIndustry",
          "sourceId": "SEG-KEY-EQUIPMENT-001",
          "targetId": "IND-EXAMPLE-001",
          "pathRole": "确认关键设备环节属于当前行业本体。"
        },
        {
          "relationId": "REL-PRD-SEG-001",
          "relationType": "productBelongsToSegment",
          "sourceId": "PRD-EQUIPMENT-A-001",
          "targetId": "SEG-KEY-EQUIPMENT-001",
          "pathRole": "确认设备品类与关键设备环节相关。"
        },
        {
          "relationId": "REL-SV-CORE-OBS-001",
          "relationType": "observedOn",
          "sourceId": "SV-CORE-CAPEX-001",
          "targetId": "SEG-CORE-PRODUCT-001",
          "pathRole": "将核心产品扩产强度挂载到核心产品环节。"
        },
        {
          "relationId": "REL-SV-EQUIP-OBS-001",
          "relationType": "observedOn",
          "sourceId": "SV-EQUIP-CAPEX-001",
          "targetId": "SEG-KEY-EQUIPMENT-001",
          "pathRole": "将关键设备资本开支强度挂载到关键设备环节。"
        },
        {
          "relationId": "REL-PROP-FROM-001",
          "relationType": "propagatesFrom",
          "sourceId": "PROP-CORE-EQUIP-001",
          "targetId": "SV-CORE-CAPEX-001",
          "pathRole": "确认变量传导来源是核心产品扩产强度。"
        },
        {
          "relationId": "REL-PROP-TO-001",
          "relationType": "propagatesTo",
          "sourceId": "PROP-CORE-EQUIP-001",
          "targetId": "SV-EQUIP-CAPEX-001",
          "pathRole": "确认变量传导目标是关键设备资本开支强度。"
        },
        {
          "relationId": "REL-HYP-VAR-001",
          "relationType": "hypothesisBindsVariable",
          "sourceId": "SH-CORE-EQUIP-001",
          "targetId": "SV-EQUIP-CAPEX-001",
          "pathRole": "将扩产拉动设备需求假设绑定到资本开支变量。"
        },
        {
          "relationId": "REL-JO-HYP-001",
          "relationType": "basedOnHypothesis",
          "sourceId": "JO-EQUIP-DEMAND-001",
          "targetId": "SH-CORE-EQUIP-001",
          "pathRole": "判断输出基于扩产拉动设备需求的假设。"
        }
      ],
      "missing_nodes": [
        "核心产品扩产投资额拆分观测值",
        "关键设备分品类订单观测值",
        "关键客户供应商份额观测值",
        "市场预期是否已反映的定价信号"
      ],
      "missing_relations": [
        "核心产品扩产强度到不同关键设备品类订单能见度的分路线传导强度关系缺失。",
        "设备订单能见度到收入确认节奏的财务传导关系缺失。"
      ],
      "retrieval_quality": "medium"
    },
    "reasoning_chains": [
      {
        "chainId": "CHAIN-CORE-EQUIP-001",
        "title": "核心产品扩产到关键设备订单能见度的主链路",
        "chainType": "propagation",
        "chainSummary": "核心产品扩产可以形成关键设备需求的候选利好，但必须经过投资额拆分、设备品类、供应商份额和交付确认验证。",
        "pathSteps": [
          {
            "step": 1,
            "ontologyObjectId": "SV-CORE-CAPEX-001",
            "objectType": "StateVariable",
            "relationId": "REL-SV-CORE-OBS-001",
            "relationType": "observedOn",
            "claim": "用户问题应先映射为核心产品扩产强度变量，而不是直接等同于设备供应商收入增长。",
            "evidenceRefs": ["SRC-20260529-001#ontology", "SRC-20260529-002#question"],
            "supportType": "confirmed_by_ontology",
            "confidenceLevel": "high"
          },
          {
            "step": 2,
            "ontologyObjectId": "PROP-CORE-EQUIP-001",
            "objectType": "StateVariablePropagation",
            "relationId": "REL-PROP-FROM-001",
            "relationType": "propagatesFrom",
            "claim": "本体中存在从核心产品扩产强度出发的变量传导候选。",
            "evidenceRefs": ["SRC-20260529-001#ontology"],
            "supportType": "confirmed_by_ontology",
            "confidenceLevel": "medium"
          },
          {
            "step": 3,
            "ontologyObjectId": "SV-EQUIP-CAPEX-001",
            "objectType": "StateVariable",
            "relationId": "REL-PROP-TO-001",
            "relationType": "propagatesTo",
            "claim": "传导目标是关键设备资本开支强度，但不同设备品类的弹性仍需拆分。",
            "evidenceRefs": ["SRC-20260529-001#ontology"],
            "supportType": "inferred_candidate",
            "confidenceLevel": "medium"
          },
          {
            "step": 4,
            "ontologyObjectId": "JO-EQUIP-DEMAND-001",
            "objectType": "JudgmentOutput",
            "relationId": "REL-JO-HYP-001",
            "relationType": "basedOnHypothesis",
            "claim": "关键设备景气度提升只能作为候选判断，需订单和份额数据验证。",
            "evidenceRefs": ["SRC-20260529-001#ontology"],